{"$schema":"../../../../schemas/abk-native-pilot.schema.json","schema_version":"1.0.0","pilot_id":"abk:pilot:abk-native-bounded-v1","campaign_id":"abk:benchmark-campaign:artifact-dag-core-v1","branch":"abk_native","captured_at":"2026-08-04T21:14:51Z","status":"passed","full_campaign":false,"raw_runs":10,"expected_full_campaign_runs":66,"campaign_sha256":"471b4f31608781205ce71d497add92d15659003a2a5852f1cc7fb59330b320d3","schema_sha256":"b4cacc60fe730faab91595f3f00b73ddf8729b494413a5eab5fa295e494b8aff","snapshot_sha256":"1fc620cb80bb0b32e594a21694de380722d4a83ec1b023510c0d11309472abae","manifest_sha256":"d136571801426fbe47a92b6db280c88fdd1b44717438765fa3898468bb896f01","entrypoint_sha256":"14cd7ea73cf99bae9ba3b59659341aab80c1d8ed0266bd6e3074e98b4a00954c","pilot_schema_sha256":"a43f05ccec2beadcbe651e5ea3f872f95fc0fdebda7dd72c1994a598bc7b2700","results":[{"evidence_id":"abk-native-pilot-com-01-normal-primary-r1","case_id":"COM-01-normal-primary","status":"passed","expected_terminal_state":"SUCCEEDED","terminal_state":"SUCCEEDED","exit_code":0,"oracle_status":"passed","error_code":null,"comparable":true,"run_relative_path":"benchmarks/campaigns/artifact-dag-core-v1/runs/abk-native-bounded-pilot-20260804/COM-01-normal-primary/abk_native/R1/run.json","run_sha256":"ec9df2f4de416e624c05a9ebe4c979708ffcde39932e38e8921a8aa331e715e4","oracle_relative_path":"benchmarks/campaigns/artifact-dag-core-v1/runs/abk-native-bounded-pilot-20260804/COM-01-normal-primary/abk_native/R1/oracle-result.json","oracle_sha256":"509cda6363de5cca8265f0703ad7b8acc64d3ff919442890a698535c4458715e"},{"evidence_id":"abk-native-pilot-com-02-normal-variant-r1","case_id":"COM-02-normal-variant","status":"passed","expected_terminal_state":"SUCCEEDED","terminal_state":"SUCCEEDED","exit_code":0,"oracle_status":"passed","error_code":null,"comparable":true,"run_relative_path":"benchmarks/campaigns/artifact-dag-core-v1/runs/abk-native-bounded-pilot-20260804/COM-02-normal-variant/abk_native/R1/run.json","run_sha256":"2a6cce932489ed9ab727589fac65b32a23e71d3d5a4705c7bba6da5ba33363c9","oracle_relative_path":"benchmarks/campaigns/artifact-dag-core-v1/runs/abk-native-bounded-pilot-20260804/COM-02-normal-variant/abk_native/R1/oracle-result.json","oracle_sha256":"dfbad532b4df6df044875eca3b9349b44e436444af29011a35fe839a62e11678"},{"evidence_id":"abk-native-pilot-com-03-normal-repeat-r1","case_id":"COM-03-normal-repeat","status":"passed","expected_terminal_state":"SUCCEEDED","terminal_state":"SUCCEEDED","exit_code":0,"oracle_status":"passed","error_code":null,"comparable":true,"run_relative_path":"benchmarks/campaigns/artifact-dag-core-v1/runs/abk-native-bounded-pilot-20260804/COM-03-normal-repeat/abk_native/R1/run.json","run_sha256":"1e6b846a67e1cf01b0f88e45728892c2d9d8ca82618ca44f325a4c3908226bc1","oracle_relative_path":"benchmarks/campaigns/artifact-dag-core-v1/runs/abk-native-bounded-pilot-20260804/COM-03-normal-repeat/abk_native/R1/oracle-result.json","oracle_sha256":"0c04741fab7739efbdd5080d568858b2b6a09d4ab0bae2fc5f93f058c06e1df8"},{"evidence_id":"abk-native-pilot-com-04-boundary-minimum-r1","case_id":"COM-04-boundary-minimum","status":"passed","expected_terminal_state":"SUCCEEDED","terminal_state":"SUCCEEDED","exit_code":0,"oracle_status":"passed","error_code":null,"comparable":true,"run_relative_path":"benchmarks/campaigns/artifact-dag-core-v1/runs/abk-native-bounded-pilot-20260804/COM-04-boundary-minimum/abk_native/R1/run.json","run_sha256":"a5e6cd20f564a1c2d08e300153a81514d71e0784a7ad956f0dc2fb2d04eb38c8","oracle_relative_path":"benchmarks/campaigns/artifact-dag-core-v1/runs/abk-native-bounded-pilot-20260804/COM-04-boundary-minimum/abk_native/R1/oracle-result.json","oracle_sha256":"74361556d562a0ad7ece4e9c25b0b94682813bfa33c442eb7ade76c9be8680a7"},{"evidence_id":"abk-native-pilot-com-05-invalid-input-r1","case_id":"COM-05-invalid-input","status":"passed","expected_terminal_state":"FAILED","terminal_state":"FAILED","exit_code":3,"oracle_status":"failed","error_code":"UNKNOWN_ARTIFACT_REFERENCE","comparable":false,"run_relative_path":"benchmarks/campaigns/artifact-dag-core-v1/runs/abk-native-bounded-pilot-20260804/COM-05-invalid-input/abk_native/R1/run.json","run_sha256":"1b19fe7bd7a872864b1a151c2077b2e63a149f4272b369e995768d0d6e974294","oracle_relative_path":"benchmarks/campaigns/artifact-dag-core-v1/runs/abk-native-bounded-pilot-20260804/COM-05-invalid-input/abk_native/R1/oracle-result.json","oracle_sha256":"d615cea4ee2716ee386a55cb6e922ca995c8ac576b7419d47766ef412e5f3411"},{"evidence_id":"abk-native-pilot-com-06-stop-interrupt-r1","case_id":"COM-06-stop-interrupt","status":"passed","expected_terminal_state":"STOPPED","terminal_state":"STOPPED","exit_code":130,"oracle_status":"stopped","error_code":"INTERRUPTED","comparable":true,"run_relative_path":"benchmarks/campaigns/artifact-dag-core-v1/runs/abk-native-bounded-pilot-20260804/COM-06-stop-interrupt/abk_native/R1/run.json","run_sha256":"78db9a7c7604bcbc08b7d2648d0501792757ef721ce30dd19a3805d7963f574c","oracle_relative_path":"benchmarks/campaigns/artifact-dag-core-v1/runs/abk-native-bounded-pilot-20260804/COM-06-stop-interrupt/abk_native/R1/oracle-result.json","oracle_sha256":"aea0c3011385ed2e6e73d9c85d513b2b10947b241ed29ef375c8849878d6cda0"},{"evidence_id":"abk-native-pilot-spc-01-domain-boundary-r1","case_id":"SPC-01-domain-boundary","status":"passed","expected_terminal_state":"REJECTED","terminal_state":"REJECTED","exit_code":2,"oracle_status":"inconclusive","error_code":"DEPENDENCY_OUT_OF_ROOT","comparable":false,"run_relative_path":"benchmarks/campaigns/artifact-dag-core-v1/runs/abk-native-bounded-pilot-20260804/SPC-01-domain-boundary/abk_native/R1/run.json","run_sha256":"710d13d64a9fdbca2cdde613e4fba50fd0395ed99306e08db6c77720b559df23","oracle_relative_path":"benchmarks/campaigns/artifact-dag-core-v1/runs/abk-native-bounded-pilot-20260804/SPC-01-domain-boundary/abk_native/R1/oracle-result.json","oracle_sha256":"4786a87554cd8afdf01f98a7fa78dfb85574a0eba7957a3ba77b590bdf36cd45"},{"evidence_id":"abk-native-pilot-spc-02-failure-path-r1","case_id":"SPC-02-failure-path","status":"passed","expected_terminal_state":"FAILED","terminal_state":"FAILED","exit_code":3,"oracle_status":"failed","error_code":"UNKNOWN_ARTIFACT_REFERENCE","comparable":false,"run_relative_path":"benchmarks/campaigns/artifact-dag-core-v1/runs/abk-native-bounded-pilot-20260804/SPC-02-failure-path/abk_native/R1/run.json","run_sha256":"595ffa814c43af32bf670d35e8ba601c695b4b5bdeeec820fd9268c54d43ed57","oracle_relative_path":"benchmarks/campaigns/artifact-dag-core-v1/runs/abk-native-bounded-pilot-20260804/SPC-02-failure-path/abk_native/R1/oracle-result.json","oracle_sha256":"8f04d57eec90634728016c4faa283c12a6a941e2f2677190f0163de16340e669"},{"evidence_id":"abk-native-pilot-spc-03-recovery-rollback-r1","case_id":"SPC-03-recovery-rollback","status":"passed","expected_terminal_state":"RECOVERED","terminal_state":"RECOVERED","exit_code":0,"oracle_status":"passed","error_code":"RECOVERED_AFTER_FAILURE","comparable":true,"run_relative_path":"benchmarks/campaigns/artifact-dag-core-v1/runs/abk-native-bounded-pilot-20260804/SPC-03-recovery-rollback/abk_native/R1/run.json","run_sha256":"15792cf281e0aa25358f749a36518c57cf7c4e10dff51958ac51e633633e5ebf","oracle_relative_path":"benchmarks/campaigns/artifact-dag-core-v1/runs/abk-native-bounded-pilot-20260804/SPC-03-recovery-rollback/abk_native/R1/oracle-result.json","oracle_sha256":"016d6cb56ea4ef8f75d989f205fa1e973dae926b5432c80b13b4cea5a8ad0cea"},{"evidence_id":"abk-native-pilot-spc-04-composition-handoff-r1","case_id":"SPC-04-composition-handoff","status":"passed","expected_terminal_state":"SUCCEEDED","terminal_state":"SUCCEEDED","exit_code":0,"oracle_status":"passed","error_code":null,"comparable":true,"run_relative_path":"benchmarks/campaigns/artifact-dag-core-v1/runs/abk-native-bounded-pilot-20260804/SPC-04-composition-handoff/abk_native/R1/run.json","run_sha256":"9931fc773020faa023bad0b08e2762fbf28dab00f97b8dbe5e1abbc3e27ac353","oracle_relative_path":"benchmarks/campaigns/artifact-dag-core-v1/runs/abk-native-bounded-pilot-20260804/SPC-04-composition-handoff/abk_native/R1/oracle-result.json","oracle_sha256":"27bed15bf33a90f5b59391aa7c4151d9d55571273d01bf158ecbf23c441c772b"}],"run_evidence_ids":["abk-native-pilot-com-01-normal-primary-r1","abk-native-pilot-com-02-normal-variant-r1","abk-native-pilot-com-03-normal-repeat-r1","abk-native-pilot-com-04-boundary-minimum-r1","abk-native-pilot-com-05-invalid-input-r1","abk-native-pilot-com-06-stop-interrupt-r1","abk-native-pilot-spc-01-domain-boundary-r1","abk-native-pilot-spc-02-failure-path-r1","abk-native-pilot-spc-03-recovery-rollback-r1","abk-native-pilot-spc-04-composition-handoff-r1"],"scorecard_state":"UNSCORED","blockers":["ABK-native is a local clean-room mapping, not execution of the external AI Booster Kit project.","The published campaign remains benchmark_pending with zero completed runs and no adoption outcome."]}